{
 "batch_id": "2026-07-19--unified",
 "channels": [
  "v-phash",
  "v-dhash",
  "v-color",
  "v-palette",
  "v-layout",
  "v-edge",
  "v-ssim",
  "c-shingle",
  "c-winnow",
  "c-feature",
  "c-ast-js",
  "c-css-prop",
  "c-ncd",
  "d-geom",
  "d-text",
  "d-pqgram",
  "d-tagpath"
 ],
 "config_a": "claude-opus-4-8-eff-high--cli--claude-code--dev",
 "config_b": "kimi-k3-eff-high--api--official--dev",
 "kind": "cross",
 "pairs": [
  {
   "diagnostics": {
    "c_ncd_ncd_sym": 0.5822222222222222,
    "v_ssim_raw": 0.5441407873519446
   },
   "s": {
    "c-ast-js": 0.9537752058658324,
    "c-css-prop": 0.9110752856760802,
    "c-feature": 0.6351351351351351,
    "c-ncd": 0.4177777777777778,
    "c-shingle": 0.4045155221072437,
    "c-winnow": 0.25826446280991733,
    "d-geom": 0.5273463358209466,
    "d-pqgram": 0.4412296564195298,
    "d-tagpath": 0.38461538461538464,
    "d-text": 0.07142857142857142,
    "v-color": 0.6127319768882709,
    "v-dhash": 0.546875,
    "v-edge": 0.6437170958965316,
    "v-layout": 0.8704767269052964,
    "v-palette": 0.010403164425353028,
    "v-phash": 0.59375,
    "v-ssim": 0.7720703936759723
   },
   "slot_a": 0,
   "slot_b": 0
  },
  {
   "diagnostics": {
    "c_ncd_ncd_sym": 0.6623578076525336,
    "v_ssim_raw": 0.3843532338653985
   },
   "s": {
    "c-ast-js": 0.9237356099101558,
    "c-css-prop": 0.9174298443913,
    "c-feature": 0.6461538461538462,
    "c-ncd": 0.3376421923474664,
    "c-shingle": 0.3009541478929234,
    "c-winnow": 0.1794871794871795,
    "d-geom": 0.7143006459435156,
    "d-pqgram": 0.6948051948051948,
    "d-tagpath": 0.2222222222222222,
    "d-text": 0.15384615384615385,
    "v-color": 0.019192791129976614,
    "v-dhash": 0.4453125,
    "v-edge": 0.6149404753999256,
    "v-layout": 0.8905011271807699,
    "v-palette": 0.07942731590639206,
    "v-phash": 0.5,
    "v-ssim": 0.6921766169326993
   },
   "slot_a": 0,
   "slot_b": 1
  },
  {
   "diagnostics": {
    "c_ncd_ncd_sym": 0.6755555555555556,
    "v_ssim_raw": 0.5468302286102111
   },
   "s": {
    "c-ast-js": 0.9393252969410336,
    "c-css-prop": 0.9296425035889763,
    "c-feature": 0.65625,
    "c-ncd": 0.3244444444444444,
    "c-shingle": 0.32394827303977736,
    "c-winnow": 0.22811059907834103,
    "d-geom": 0.6522874752246757,
    "d-pqgram": 0.8709055876685935,
    "d-tagpath": 0.5555555555555556,
    "d-text": 0.0,
    "v-color": 0.5644532742231431,
    "v-dhash": 0.52734375,
    "v-edge": 0.6902299441122157,
    "v-layout": 0.8642112565048659,
    "v-palette": 0.00947492812493771,
    "v-phash": 0.625,
    "v-ssim": 0.7734151143051056
   },
   "slot_a": 0,
   "slot_b": 2
  },
  {
   "diagnostics": {
    "c_ncd_ncd_sym": 0.7668776371308017,
    "v_ssim_raw": 0.3966458117626559
   },
   "s": {
    "c-ast-js": 0.8629524773220412,
    "c-css-prop": 0.8487454118372952,
    "c-feature": 0.4298245614035088,
    "c-ncd": 0.2331223628691983,
    "c-shingle": 0.16387644423485026,
    "c-winnow": 0.1658206429780034,
    "d-geom": 0.7761882612552193,
    "d-pqgram": 0.26763110307414106,
    "d-tagpath": 0.18181818181818182,
    "d-text": 0.02564102564102564,
    "v-color": 0.3699226732573071,
    "v-dhash": 0.48828125,
    "v-edge": 0.7352531320897138,
    "v-layout": 0.8640179619327507,
    "v-palette": 0.8736200929992434,
    "v-phash": 0.625,
    "v-ssim": 0.698322905881328
   },
   "slot_a": 0,
   "slot_b": 3
  },
  {
   "diagnostics": {
    "c_ncd_ncd_sym": 0.5476758045292014,
    "v_ssim_raw": 0.574839087288609
   },
   "s": {
    "c-ast-js": 0.9848051493566796,
    "c-css-prop": 0.8769394525974176,
    "c-feature": 0.5584415584415584,
    "c-ncd": 0.4523241954707986,
    "c-shingle": 0.4230503795721187,
    "c-winnow": 0.2691588785046729,
    "d-geom": 0.4967378605090776,
    "d-pqgram": 0.4541832669322709,
    "d-tagpath": 0.5454545454545454,
    "d-text": 0.0,
    "v-color": 0.6596287392258322,
    "v-dhash": 0.4921875,
    "v-edge": 0.6718414389340647,
    "v-layout": 0.9259259076622683,
    "v-palette": 0.023205819848709595,
    "v-phash": 0.65625,
    "v-ssim": 0.7874195436443046
   },
   "slot_a": 1,
   "slot_b": 0
  },
  {
   "diagnostics": {
    "c_ncd_ncd_sym": 0.6282316442605997,
    "v_ssim_raw": 0.3424466946565163
   },
   "s": {
    "c-ast-js": 0.961255148134152,
    "c-css-prop": 0.9206832558799241,
    "c-feature": 0.6825396825396826,
    "c-ncd": 0.37176835573940026,
    "c-shingle": 0.3594566353187043,
    "c-winnow": 0.34275618374558303,
    "d-geom": 0.6728408837313105,
    "d-pqgram": 0.7433628318584071,
    "d-tagpath": 0.4,
    "d-text": 0.0,
    "v-color": 0.02558777073658811,
    "v-dhash": 0.4296875,
    "v-edge": 0.7351680466288413,
    "v-layout": 0.9110184701444685,
    "v-palette": 0.00849751107233735,
    "v-phash": 0.65625,
    "v-ssim": 0.6712233473282582
   },
   "slot_a": 1,
   "slot_b": 1
  },
  {
   "diagnostics": {
    "c_ncd_ncd_sym": 0.57997311827957,
    "v_ssim_raw": 0.5884600804559962
   },
   "s": {
    "c-ast-js": 0.982922807337746,
    "c-css-prop": 0.9376910527524785,
    "c-feature": 0.6666666666666666,
    "c-ncd": 0.42002688172043,
    "c-shingle": 0.38268365817091454,
    "c-winnow": 0.40232558139534885,
    "d-geom": 0.6081516938184353,
    "d-pqgram": 0.9914529914529915,
    "d-tagpath": 0.8571428571428571,
    "d-text": 0.1,
    "v-color": 0.620155049834283,
    "v-dhash": 0.44140625,
    "v-edge": 0.7864023110391911,
    "v-layout": 0.9294664694364594,
    "v-palette": 0.023458787707730983,
    "v-phash": 0.59375,
    "v-ssim": 0.794230040227998
   },
   "slot_a": 1,
   "slot_b": 2
  },
  {
   "diagnostics": {
    "c_ncd_ncd_sym": 0.7621308016877637,
    "v_ssim_raw": 0.41587769275190223
   },
   "s": {
    "c-ast-js": 0.8974966196812849,
    "c-css-prop": 0.8288320046865645,
    "c-feature": 0.42105263157894735,
    "c-ncd": 0.2378691983122363,
    "c-shingle": 0.1834151382071816,
    "c-winnow": 0.2066772655007949,
    "d-geom": 0.8240161824200058,
    "d-pqgram": 0.2788844621513944,
    "d-tagpath": 0.19047619047619047,
    "d-text": 0.0,
    "v-color": 0.7096408959546657,
    "v-dhash": 0.55859375,
    "v-edge": 0.8656269823726721,
    "v-layout": 0.9127296167254774,
    "v-palette": 0.8709332298588528,
    "v-phash": 0.53125,
    "v-ssim": 0.7079388463759511
   },
   "slot_a": 1,
   "slot_b": 3
  }
 ],
 "variant": "P-min"
}
