{
 "batch_id": "2026-07-19--unified",
 "channels": [
  "v-phash",
  "v-dhash",
  "v-color",
  "v-palette",
  "v-layout",
  "v-edge",
  "v-ssim",
  "c-shingle",
  "c-winnow",
  "c-feature",
  "c-ast-js",
  "c-css-prop",
  "c-ncd",
  "d-geom",
  "d-text",
  "d-pqgram",
  "d-tagpath"
 ],
 "config_a": "doubao-seed-2-1-pro-eff-disabled--api--official--dev",
 "config_b": "gpt-5.6-sol-eff-high--cli--codex-oauth--dev",
 "kind": "cross",
 "pairs": [
  {
   "diagnostics": {
    "c_ncd_ncd_sym": 0.8371616078753077,
    "v_ssim_raw": 0.30274926137194774
   },
   "s": {
    "c-ast-js": 0.698006506232835,
    "c-css-prop": 0.7481838306759422,
    "c-feature": 0.296875,
    "c-ncd": 0.1628383921246923,
    "c-shingle": 0.189873417721519,
    "c-winnow": 0.19591141396933562,
    "d-geom": 0.8030462184873942,
    "d-pqgram": 0.25146198830409355,
    "d-tagpath": 0.18181818181818182,
    "d-text": 0.0,
    "v-color": 0.006086026044829146,
    "v-dhash": 0.69140625,
    "v-edge": 0.7682813395663481,
    "v-layout": 0.9276556549597362,
    "v-palette": 0.0009507597222447504,
    "v-phash": 0.46875,
    "v-ssim": 0.6513746306859739
   },
   "slot_a": 0,
   "slot_b": 0
  },
  {
   "diagnostics": {
    "c_ncd_ncd_sym": 0.8605086013462977,
    "v_ssim_raw": 0.35135344524087553
   },
   "s": {
    "c-ast-js": 0.777915593357805,
    "c-css-prop": 0.7725393039369072,
    "c-feature": 0.28225806451612906,
    "c-ncd": 0.1394913986537023,
    "c-shingle": 0.16622974261201143,
    "c-winnow": 0.17457627118644067,
    "d-geom": 0.7078703703703697,
    "d-pqgram": 0.17857142857142858,
    "d-tagpath": 0.16666666666666666,
    "d-text": 0.0,
    "v-color": 0.8012670546725147,
    "v-dhash": 0.50390625,
    "v-edge": 0.87533223791695,
    "v-layout": 0.7992761890003793,
    "v-palette": 0.18281750964954743,
    "v-phash": 0.4375,
    "v-ssim": 0.6756767226204378
   },
   "slot_a": 0,
   "slot_b": 1
  },
  {
   "diagnostics": {
    "c_ncd_ncd_sym": 0.8531583264971287,
    "v_ssim_raw": 0.3612097732027754
   },
   "s": {
    "c-ast-js": 0.7946625345939938,
    "c-css-prop": 0.7712875069737809,
    "c-feature": 0.3023255813953488,
    "c-ncd": 0.14684167350287125,
    "c-shingle": 0.1707713464183023,
    "c-winnow": 0.18548387096774194,
    "d-geom": 0.5506827731092432,
    "d-pqgram": 0.19027484143763213,
    "d-tagpath": 0.17391304347826086,
    "d-text": 0.0,
    "v-color": 0.008256499210492768,
    "v-dhash": 0.63671875,
    "v-edge": 0.7762247316721155,
    "v-layout": 0.9059306114080955,
    "v-palette": 0.000640448376191389,
    "v-phash": 0.4375,
    "v-ssim": 0.6806048866013877
   },
   "slot_a": 1,
   "slot_b": 0
  },
  {
   "diagnostics": {
    "c_ncd_ncd_sym": 0.8706058339566194,
    "v_ssim_raw": 0.3624202214480465
   },
   "s": {
    "c-ast-js": 0.8571012500129401,
    "c-css-prop": 0.7647736081842937,
    "c-feature": 0.319672131147541,
    "c-ncd": 0.1293941660433806,
    "c-shingle": 0.1507293354943274,
    "c-winnow": 0.17475728155339806,
    "d-geom": 0.4854166666666662,
    "d-pqgram": 0.14488188976377953,
    "d-tagpath": 0.16,
    "d-text": 0.0,
    "v-color": 0.6116774800578372,
    "v-dhash": 0.55078125,
    "v-edge": 0.8728754573347012,
    "v-layout": 0.7915282069088383,
    "v-palette": 0.17134345275858176,
    "v-phash": 0.4375,
    "v-ssim": 0.6812101107240233
   },
   "slot_a": 1,
   "slot_b": 1
  },
  {
   "diagnostics": {
    "c_ncd_ncd_sym": 0.8301886792452831,
    "v_ssim_raw": 0.29754214496200104
   },
   "s": {
    "c-ast-js": 0.8634530429544165,
    "c-css-prop": 0.7878282214927671,
    "c-feature": 0.3157894736842105,
    "c-ncd": 0.16981132075471694,
    "c-shingle": 0.18834622823984526,
    "c-winnow": 0.2115085536547434,
    "d-geom": 0.7563025210084033,
    "d-pqgram": 0.20147420147420148,
    "d-tagpath": 0.17391304347826086,
    "d-text": 0.0,
    "v-color": 5.789513984344463e-05,
    "v-dhash": 0.5078125,
    "v-edge": 0.6062714475143289,
    "v-layout": 0.9505743693624427,
    "v-palette": 0.0047011663607988505,
    "v-phash": 0.625,
    "v-ssim": 0.6487710724810005
   },
   "slot_a": 2,
   "slot_b": 0
  },
  {
   "diagnostics": {
    "c_ncd_ncd_sym": 0.8556469708302169,
    "v_ssim_raw": 0.37217069477833803
   },
   "s": {
    "c-ast-js": 0.7904708371112635,
    "c-css-prop": 0.7512653193575823,
    "c-feature": 0.3228346456692913,
    "c-ncd": 0.1443530291697831,
    "c-shingle": 0.16582633053221288,
    "c-winnow": 0.1937984496124031,
    "d-geom": 0.6666666666666666,
    "d-pqgram": 0.1616871704745167,
    "d-tagpath": 0.16,
    "d-text": 0.0,
    "v-color": 0.017208379440386976,
    "v-dhash": 0.5078125,
    "v-edge": 0.6833355534387374,
    "v-layout": 0.8799918674050493,
    "v-palette": 0.8661995861099996,
    "v-phash": 0.4375,
    "v-ssim": 0.686085347389169
   },
   "slot_a": 2,
   "slot_b": 1
  },
  {
   "diagnostics": {
    "c_ncd_ncd_sym": 0.8260869565217391,
    "v_ssim_raw": 0.3313508088825892
   },
   "s": {
    "c-ast-js": 0.882407362118928,
    "c-css-prop": 0.8126518345373235,
    "c-feature": 0.36363636363636365,
    "c-ncd": 0.17391304347826086,
    "c-shingle": 0.1895360315893386,
    "c-winnow": 0.23244929797191888,
    "d-geom": 0.7090336134453782,
    "d-pqgram": 0.18639798488664988,
    "d-tagpath": 0.19047619047619047,
    "d-text": null,
    "v-color": 0.00019223166069449196,
    "v-dhash": 0.41796875,
    "v-edge": 0.6964663702845685,
    "v-layout": 0.9478812851366738,
    "v-palette": 0.0005661559762813445,
    "v-phash": 0.71875,
    "v-ssim": 0.6656754044412946
   },
   "slot_a": 3,
   "slot_b": 0
  },
  {
   "diagnostics": {
    "c_ncd_ncd_sym": 0.844427823485415,
    "v_ssim_raw": 0.4008288497882817
   },
   "s": {
    "c-ast-js": 0.9303240105532579,
    "c-css-prop": 0.7565396332967417,
    "c-feature": 0.3515625,
    "c-ncd": 0.155572176514585,
    "c-shingle": 0.18325031854511759,
    "c-winnow": 0.21651090342679127,
    "d-geom": 0.625,
    "d-pqgram": 0.13953488372093023,
    "d-tagpath": 0.17391304347826086,
    "d-text": null,
    "v-color": 0.023280628619885977,
    "v-dhash": 0.49609375,
    "v-edge": 0.7453476948040709,
    "v-layout": 0.8818870101461356,
    "v-palette": 0.08763337740012699,
    "v-phash": 0.40625,
    "v-ssim": 0.7004144248941409
   },
   "slot_a": 3,
   "slot_b": 1
  }
 ],
 "variant": "P-min"
}
